{
  "schema_version": "1.0",
  "policy_id": "production-old-v1",
  "policy_version": "1.1.0",
  "accepted_snapshot_schemas": ["1.4"],
  "observation": {
    "minimum_samples": 30,
    "minimum_duration_seconds": 1800
  },
  "required_capabilities": [
    "show ethernet-switching table",
    "show ethernet-switching table detail",
    "show interfaces terse",
    "show lldp neighbors detail",
    "show lacp interfaces"
  ],
  "require_virtual_chassis": true
}
